{
  "$schema": "https://json-schema.org/draft/2020-12/schema",
  "title": "config/facebook-sources.json",
  "type": "object",
  "required": ["schema_version", "pages"],
  "additionalProperties": false,
  "properties": {
    "schema_version": {"const": 1},
    "updated_at": {"$ref": "#/$defs/timestamp"},
    "user_agent": {"type": "string", "minLength": 1},
    "notes": {"type": ["array", "string", "null"]},
    "pages": {
      "type": "array",
      "items": {
        "type": "object",
        "required": ["source_id", "name", "facebook_page", "region", "priority", "check_interval_days", "enabled"],
        "additionalProperties": false,
        "properties": {
          "source_id": {"type": "string", "pattern": "^[a-z0-9]+(-[a-z0-9]+)*$"},
          "name": {"type": "string", "minLength": 1},
          "facebook_page": {"type": "string", "minLength": 1},
          "municipality": {"type": ["string", "null"]},
          "district": {"type": ["string", "null"]},
          "region": {
            "anyOf": [
              {"enum": ["pardubicky-kraj", "kralovehradecky-kraj"]},
              {"type": "null"}
            ]
          },
          "priority": {"enum": ["high", "normal", "low"]},
          "check_interval_days": {"type": "integer", "minimum": 1},
          "enabled": {"type": "boolean"},
          "notes": {"type": ["string", "null"]}
        }
      }
    }
  },
  "$defs": {
    "timestamp": {
      "type": "string",
      "pattern": "^\\d{4}-\\d{2}-\\d{2}T\\d{2}:\\d{2}:\\d{2}(\\.\\d+)?([+-]\\d{2}:\\d{2}|Z)$"
    }
  }
}
