{
  "schema_version": 1,
  "updated_at": "2026-08-03T19:44:58+02:00",
  "user_agent": "PardubickoEventsBot/0.1 (+https://github.com/petrfilip/pardubicko-events)",
  "notes": [
    "Seznam veřejných facebookových stránek pořadatelů pro deterministický sběr v tools/fb-events.",
    "Kanál cílí na městské kulturní instituce. Malí venkovští pořadatelé Facebook události nezakládají, viz docs/agents/facebook-agent.md.",
    "Města obvykle akce na Facebook nedávají a publikují je na webu; výjimkou jsou Pardubice a Náchod.",
    "Historická měření výtěžnosti byla 3. 8. 2026 jednorázově přesunuta do SQLite source_health; tento soubor drží jen konfiguraci."
  ],
  "pages": [
    {
      "source_id": "chrudimska-beseda",
      "name": "Chrudimská beseda – kalendář akcí",
      "facebook_page": "Chrudimskabeseda",
      "municipality": "Chrudim",
      "district": "Chrudim",
      "region": "pardubicky-kraj",
      "priority": "high",
      "check_interval_days": 2,
      "enabled": true,
      "notes": "Převzato z dřívějšího ověření (nepřeověřováno v tomto běhu). Facebook zobrazil prvních 8 akcí bez scrollování – seznam je stránkovaný, reálný počet nadcházejících akcí může být vyšší."
    },
    {
      "source_id": "nachod-city",
      "name": "Město Náchod",
      "facebook_page": "mestonachod.cz",
      "municipality": "Náchod",
      "district": "Náchod",
      "region": "kralovehradecky-kraj",
      "priority": "high",
      "check_interval_days": 2,
      "enabled": true,
      "notes": "Facebook zobrazil prvních 8 akcí bez scrollování – seznam je stránkovaný, reálný počet nadcházejících akcí může být vyšší. Seznam obsahuje i opakované akce (více termínů pod jedním ID). Na webu města je i profil micnachod (Městské informační centrum) – vhodný jako doplňkový zdroj."
    },
    {
      "source_id": "pardubice-calendar",
      "name": "Pardubice.eu – kalendář akcí",
      "facebook_page": "mestopardubice",
      "municipality": "Pardubice",
      "district": "Pardubice",
      "region": "pardubicky-kraj",
      "priority": "high",
      "check_interval_days": 2,
      "enabled": true,
      "notes": "Facebook zobrazil prvních 8 akcí bez scrollování – seznam je stránkovaný, reálný počet nadcházejících akcí může být vyšší."
    },
    {
      "source_id": "uffo-trutnov",
      "name": "UFFO Trutnov",
      "facebook_page": "uffo.cz",
      "municipality": "Trutnov",
      "district": "Trutnov",
      "region": "kralovehradecky-kraj",
      "priority": "high",
      "check_interval_days": 2,
      "enabled": true,
      "notes": "Facebook zobrazil prvních 8 akcí bez scrollování – seznam je stránkovaný, reálný počet nadcházejících akcí může být vyšší. V patičce uffo.cz je i profil caffeuffo (kavárna) – nepoužívat."
    },
    {
      "source_id": "zamek-litomysl",
      "name": "Zámek Litomyšl",
      "facebook_page": "szlitomysl",
      "municipality": "Litomyšl",
      "district": "Svitavy",
      "region": "pardubicky-kraj",
      "priority": "high",
      "check_interval_days": 2,
      "enabled": true,
      "notes": "Facebook zobrazil prvních 8 akcí bez scrollování – seznam je stránkovaný, reálný počet nadcházejících akcí může být vyšší. Patička zamek-litomysl.cz odkazuje na starý tvar /pages/Castle-Litomysl/1480803648820838; vanity handle szlitomysl ověřen jako správný (název stránky sedí)."
    },
    {
      "source_id": "zamek-pardubice",
      "name": "Zámek Pardubice",
      "facebook_page": "zamekpardubice",
      "municipality": "Pardubice",
      "district": "Pardubice",
      "region": "pardubicky-kraj",
      "priority": "high",
      "check_interval_days": 2,
      "enabled": true,
      "notes": "Facebook zobrazil prvních 8 akcí bez scrollování – seznam je stránkovaný, reálný počet nadcházejících akcí může být vyšší."
    },
    {
      "source_id": "bio-central",
      "name": "Bio Central",
      "facebook_page": "centralbio",
      "municipality": "Hradec Králové",
      "district": "Hradec Králové",
      "region": "kralovehradecky-kraj",
      "priority": "high",
      "check_interval_days": 2,
      "enabled": true,
      "notes": ""
    },
    {
      "source_id": "muzeum-vychodnich-cech",
      "name": "Muzeum východních Čech",
      "facebook_page": "muzeumhk.cz",
      "municipality": "Hradec Králové",
      "district": "Hradec Králové",
      "region": "kralovehradecky-kraj",
      "priority": "high",
      "check_interval_days": 2,
      "enabled": true,
      "notes": "Seznam se rendruje pomalu – při 3,5 s čekání vracel 0, při 8 s 6 akcí. Pro tento profil použít delší wait."
    },
    {
      "source_id": "divadlo-29",
      "name": "Divadlo 29 Pardubice",
      "facebook_page": "divadlo29",
      "municipality": "Pardubice",
      "district": "Pardubice",
      "region": "pardubicky-kraj",
      "priority": "high",
      "check_interval_days": 2,
      "enabled": true,
      "notes": "Nový zdroj – v source-registry.json zatím není. Převzato z dřívějšího ověření."
    },
    {
      "source_id": "divadlo-karla-pippicha",
      "name": "Divadlo Karla Pippicha Chrudim",
      "facebook_page": "DivadloKarlaPippichaChrudim",
      "municipality": "Chrudim",
      "district": "Chrudim",
      "region": "pardubicky-kraj",
      "priority": "normal",
      "check_interval_days": 3,
      "enabled": true,
      "notes": "Nový zdroj – v source-registry.json zatím není. Převzato z dřívějšího ověření."
    },
    {
      "source_id": "automaticke-mlyny",
      "name": "Automatické mlýny",
      "facebook_page": "automatickemlyny",
      "municipality": "Pardubice",
      "district": "Pardubice",
      "region": "pardubicky-kraj",
      "priority": "normal",
      "check_interval_days": 3,
      "enabled": true,
      "notes": "Převzato z dřívějšího ověření (nepřeověřováno v tomto běhu)."
    },
    {
      "source_id": "zamek-nachod",
      "name": "Zámek Náchod",
      "facebook_page": "zamek.nachod",
      "municipality": "Náchod",
      "district": "Náchod",
      "region": "kralovehradecky-kraj",
      "priority": "normal",
      "check_interval_days": 3,
      "enabled": true,
      "notes": "Web odkazuje na starý tvar /pages/Státní-zámek-Náchod/266756093517424; vanity handle zamek.nachod ověřen."
    },
    {
      "source_id": "fhk",
      "name": "Filharmonie Hradec Králové",
      "facebook_page": "filharmonie.hradec.kralove",
      "municipality": "Hradec Králové",
      "district": "Hradec Králové",
      "region": "kralovehradecky-kraj",
      "priority": "normal",
      "check_interval_days": 3,
      "enabled": true,
      "notes": ""
    },
    {
      "source_id": "divadlo-drak",
      "name": "Divadlo Drak",
      "facebook_page": "DrakHK",
      "municipality": "Hradec Králové",
      "district": "Hradec Králové",
      "region": "kralovehradecky-kraj",
      "priority": "normal",
      "check_interval_days": 3,
      "enabled": true,
      "notes": "Handle obsahuje velká písmena (DrakHK)."
    },
    {
      "source_id": "dvur-kralove-city",
      "name": "Město Dvůr Králové nad Labem",
      "facebook_page": "mestodknl",
      "municipality": "Dvůr Králové nad Labem",
      "district": "Trutnov",
      "region": "kralovehradecky-kraj",
      "priority": "normal",
      "check_interval_days": 3,
      "enabled": true,
      "notes": ""
    },
    {
      "source_id": "galerie-modernihoumeni-hk",
      "name": "Galerie moderního umění v Hradci Králové",
      "facebook_page": "gmuhk",
      "municipality": "Hradec Králové",
      "district": "Hradec Králové",
      "region": "kralovehradecky-kraj",
      "priority": "normal",
      "check_interval_days": 3,
      "enabled": true,
      "notes": ""
    },
    {
      "source_id": "jicin-city",
      "name": "Město Jičín",
      "facebook_page": "jicin.cz",
      "municipality": "Jičín",
      "district": "Jičín",
      "region": "kralovehradecky-kraj",
      "priority": "normal",
      "check_interval_days": 3,
      "enabled": true,
      "notes": ""
    },
    {
      "source_id": "klicperovo-divadlo",
      "name": "Klicperovo divadlo",
      "facebook_page": "klicperovo.divadlo",
      "municipality": "Hradec Králové",
      "district": "Hradec Králové",
      "region": "kralovehradecky-kraj",
      "priority": "normal",
      "check_interval_days": 3,
      "enabled": true,
      "notes": "Divadelní program jede přes web, Facebook je zde slabý zdroj."
    },
    {
      "source_id": "letos-rychtarem",
      "name": "Letos rychtářem – Hlinsko",
      "facebook_page": "letosrychtarem",
      "municipality": "Hlinsko",
      "district": "Chrudim",
      "region": "pardubicky-kraj",
      "priority": "normal",
      "check_interval_days": 3,
      "enabled": true,
      "notes": "Nový zdroj – v source-registry.json zatím není. Převzato z dřívějšího ověření."
    },
    {
      "source_id": "slatinany-city",
      "name": "Město Slatiňany",
      "facebook_page": "Slatinany",
      "municipality": "Slatiňany",
      "district": "Chrudim",
      "region": "pardubicky-kraj",
      "priority": "normal",
      "check_interval_days": 3,
      "enabled": true,
      "notes": ""
    },
    {
      "source_id": "vesely-kopec",
      "name": "Muzeum v přírodě Vysočina – Veselý Kopec",
      "facebook_page": "muzeumvprirodevysocina",
      "municipality": "Vysočina",
      "district": "Chrudim",
      "region": "pardubicky-kraj",
      "priority": "normal",
      "check_interval_days": 3,
      "enabled": true,
      "notes": "Web nmvp.cz/vysocina má v patičce i starý tvar facebook.com/Muzeum-v-přírodě-Vysočina-100969419070437 – použit vanity handle."
    },
    {
      "source_id": "zamek-slatinany",
      "name": "Zámek Slatiňany",
      "facebook_page": "zamek.slatinany",
      "municipality": "Slatiňany",
      "district": "Chrudim",
      "region": "pardubicky-kraj",
      "priority": "normal",
      "check_interval_days": 3,
      "enabled": true,